{
  "schemaVersion": "chimpmaera.bi/adaptive-investigation-state/v1",
  "graphId": "superset-bi.adaptive-investigation.v1",
  "runId": "graph-adaptive-v1-local",
  "status": "complete",
  "sourceRefs": [
    {
      "id": "graph-schema-v1",
      "path": "/home/jo/.openclaw/workspace/superset-bi-agent-graph-adaptive-v1-20260815/contracts/bi-adaptive-investigation-graph/v1/graph-spec.schema.json",
      "sha256": "41714b0afefda6460ddccc2ff847d07bdb87e996be0b3e85b0c4875bb5ad28f0",
      "classification": "contract"
    },
    {
      "id": "state-schema-v1",
      "path": "/home/jo/.openclaw/workspace/superset-bi-agent-graph-adaptive-v1-20260815/contracts/bi-adaptive-investigation-graph/v1/state.schema.json",
      "sha256": "e699a2f24ae79670a25a110ca47555f411facfb03c4d9da3cce01a82dedff3ca",
      "classification": "contract"
    },
    {
      "id": "receipt-schema-v1",
      "path": "/home/jo/.openclaw/workspace/superset-bi-agent-graph-adaptive-v1-20260815/contracts/bi-adaptive-investigation-graph/v1/receipt.schema.json",
      "sha256": "d6184917c247dfb940ad81aa4399e91dcc39b0941cf86c3952377e1458486221",
      "classification": "contract"
    },
    {
      "id": "evidence-pack-schema-v1",
      "path": "/home/jo/.openclaw/workspace/superset-bi-agent-graph-adaptive-v1-20260815/contracts/bi-adaptive-investigation-graph/v1/evidence-pack.schema.json",
      "sha256": "24a3ae11f2355ec6fdbc97a64c1153b51df290cb340b458751722e1e25307ee8",
      "classification": "contract"
    },
    {
      "id": "sealed-neutral-packs-v1",
      "path": "/home/jo/.openclaw/workspace/superset-bi-agent-graph-adaptive-v1-20260815/services/bi-control/fixtures/graph-adaptive-v1/sealed-neutral-packs.json",
      "sha256": "b6ff8b240c29cb7f49fcf55c3ef3e387f44e9510f8f528a2bf31bfe3d665099f",
      "classification": "sealed"
    },
    {
      "id": "candidate-freeze-v1",
      "path": "docs/evidence/graph-adaptive-v1/candidate-freeze.json",
      "sha256": "a72dba3d22e15e8ea6111b94742c3097d77771282d01fcee4161bbabc039bd48",
      "classification": "candidate_freeze"
    }
  ],
  "sealedInputs": [
    {
      "id": "neutral-easy-atlas",
      "tier": "easy",
      "inputDigest": "6b16f4f478ccc365420e0d893a72d113e8213e64ee6d462e485302e430600b46"
    },
    {
      "id": "neutral-easy-boreal",
      "tier": "easy",
      "inputDigest": "f6bc64ff2e22685840dcdc3f8ff850a88246b193ef67ba73689e93c3b90cc785"
    },
    {
      "id": "neutral-medium-cinder",
      "tier": "medium",
      "inputDigest": "438363e1e565aa3945017c89ee9a47e7026be4b3f4ac58d270df0886e2873a3a"
    },
    {
      "id": "neutral-medium-delta",
      "tier": "medium",
      "inputDigest": "0d0ad4917e6f6970375d064517999b7b980a89eaf5ae3d6e719e6dea129b78d5"
    },
    {
      "id": "neutral-hard-ember",
      "tier": "hard",
      "inputDigest": "ef1b5eaa3f571e0b437ea933007b0b3be0ba9d600d02152d68d69adf1a1e2cd9"
    },
    {
      "id": "neutral-hard-fjord",
      "tier": "hard",
      "inputDigest": "607b45c5451478a82fc81818ccbfaaa615e897602be7ad533229b457ead29b52"
    }
  ],
  "nodeOutputs": {
    "BI-G2_adaptive_contracts": {
      "nodeId": "BI-G2_adaptive_contracts",
      "gate": "BI-G2",
      "mutationPerformed": false,
      "sourceRowsPersisted": false,
      "contract": {
        "typedUncertaintyGapLedger": true,
        "boundedBranches": true,
        "budgetedProbes": true,
        "pauseResumeReplay": true,
        "evidenceHashes": true,
        "failClosedSchemaValidation": true
      }
    },
    "BI-G3_profile_ledger": {
      "cases": [
        {
          "caseId": "neutral-easy-atlas",
          "tier": "easy",
          "inputDigest": "6b16f4f478ccc365420e0d893a72d113e8213e64ee6d462e485302e430600b46",
          "anomalyLabels": [],
          "profileOnly": true,
          "sourceRowsPersisted": false,
          "sampleValuesPersisted": false,
          "hardFailures": [],
          "nonclaims": [
            "aggregate profile summary, not raw-row completeness",
            "sampling summary cannot prove source truth"
          ]
        },
        {
          "caseId": "neutral-easy-boreal",
          "tier": "easy",
          "inputDigest": "f6bc64ff2e22685840dcdc3f8ff850a88246b193ef67ba73689e93c3b90cc785",
          "anomalyLabels": [
            "format_noise"
          ],
          "profileOnly": true,
          "sourceRowsPersisted": false,
          "sampleValuesPersisted": false,
          "hardFailures": [],
          "nonclaims": [
            "aggregate profile summary, not raw-row completeness",
            "sampling summary cannot prove source truth"
          ]
        },
        {
          "caseId": "neutral-medium-cinder",
          "tier": "medium",
          "inputDigest": "438363e1e565aa3945017c89ee9a47e7026be4b3f4ac58d270df0886e2873a3a",
          "anomalyLabels": [
            "grain_conflict",
            "material_missingness",
            "outlier_cluster"
          ],
          "profileOnly": true,
          "sourceRowsPersisted": false,
          "sampleValuesPersisted": false,
          "hardFailures": [],
          "nonclaims": [
            "aggregate profile summary, not raw-row completeness",
            "sampling summary cannot prove source truth"
          ]
        },
        {
          "caseId": "neutral-medium-delta",
          "tier": "medium",
          "inputDigest": "0d0ad4917e6f6970375d064517999b7b980a89eaf5ae3d6e719e6dea129b78d5",
          "anomalyLabels": [
            "corruption_signal",
            "format_noise",
            "outlier_cluster"
          ],
          "profileOnly": true,
          "sourceRowsPersisted": false,
          "sampleValuesPersisted": false,
          "hardFailures": [],
          "nonclaims": [
            "aggregate profile summary, not raw-row completeness",
            "sampling summary cannot prove source truth"
          ]
        },
        {
          "caseId": "neutral-hard-ember",
          "tier": "hard",
          "inputDigest": "ef1b5eaa3f571e0b437ea933007b0b3be0ba9d600d02152d68d69adf1a1e2cd9",
          "anomalyLabels": [
            "corruption_signal",
            "format_noise",
            "grain_conflict",
            "material_missingness"
          ],
          "profileOnly": true,
          "sourceRowsPersisted": false,
          "sampleValuesPersisted": false,
          "hardFailures": [],
          "nonclaims": [
            "aggregate profile summary, not raw-row completeness",
            "sampling summary cannot prove source truth"
          ]
        },
        {
          "caseId": "neutral-hard-fjord",
          "tier": "hard",
          "inputDigest": "607b45c5451478a82fc81818ccbfaaa615e897602be7ad533229b457ead29b52",
          "anomalyLabels": [
            "format_noise",
            "grain_conflict",
            "material_missingness",
            "outlier_cluster"
          ],
          "profileOnly": true,
          "sourceRowsPersisted": false,
          "sampleValuesPersisted": false,
          "hardFailures": [],
          "nonclaims": [
            "aggregate profile summary, not raw-row completeness",
            "sampling summary cannot prove source truth"
          ]
        }
      ],
      "privacyFilter": "passed",
      "samplingClaimsDenied": true,
      "sourceRowsPersisted": false,
      "mutationPerformed": false
    },
    "BI-G4_hypothesis_graph": {
      "candidateFreeze": {
        "schemaVersion": "chimpmaera.bi/adaptive-investigation-candidate-freeze/v1",
        "frozenBeforeSealedRun": true,
        "baseCommit": "626fb43f7a8a684527db8921fa757e6bc195388d",
        "modelRoute": "offline-deterministic-fixtures",
        "liveModelUsed": false,
        "implementationDigest": "e79c7ae174f2c1a7e4d199740a9ff20889c506c993f953cf414eb10e1af4b7e0",
        "nonclaims": [
          "no live Qwen run",
          "no production/customer generalization",
          "no raw-row evidence"
        ],
        "sha256": "a72dba3d22e15e8ea6111b94742c3097d77771282d01fcee4161bbabc039bd48"
      },
      "cases": [
        {
          "caseId": "neutral-easy-atlas",
          "tier": "easy",
          "primaryHypothesis": "order_fulfillment_margin",
          "uncertainty": "medium",
          "alternatives": [
            {
              "domain": "order_fulfillment_margin",
              "confidence": 0.72,
              "citation": "terms:orders shipments returns margin",
              "grainGate": "compatible"
            },
            {
              "domain": "operational_quality_monitoring",
              "confidence": 0.48,
              "citation": "profile_summaries_only",
              "grainGate": "alternative"
            },
            {
              "domain": "financial_adjustment_review",
              "confidence": 0.33,
              "citation": "aggregate_names_only",
              "grainGate": "alternative_nonclaim"
            }
          ],
          "contradictionEvidence": [],
          "citationGate": true,
          "grainGate": "passed",
          "gapLedger": [],
          "hardFailures": []
        },
        {
          "caseId": "neutral-easy-boreal",
          "tier": "easy",
          "primaryHypothesis": "supplier_quality_lead_time",
          "uncertainty": "medium",
          "alternatives": [
            {
              "domain": "supplier_quality_lead_time",
              "confidence": 0.72,
              "citation": "terms:supplier receipt defect lead_time",
              "grainGate": "compatible"
            },
            {
              "domain": "operational_quality_monitoring",
              "confidence": 0.48,
              "citation": "profile_summaries_only",
              "grainGate": "alternative"
            },
            {
              "domain": "financial_adjustment_review",
              "confidence": 0.33,
              "citation": "aggregate_names_only",
              "grainGate": "alternative_nonclaim"
            }
          ],
          "contradictionEvidence": [],